"Status","Start Time","Stop Time","Duration in ms","Parent Suite","Suite","Sub Suite","Test Class","Test Method","Name","Description"
"passed","Tue Nov 16 01:57:05 GMT 2021","Tue Nov 16 01:59:10 GMT 2021","124910","","Accuracy tests","","Accuracy tests","As a User I get the right values for Pool investment P[2500000000000000000, 5000000000000000000] - I-> 0.100 -Expected - 0.200","As a User I get the right values for Pool investment P[2500000000000000000, 5000000000000000000] - I-> 0.100 -Expected - 0.200",""
"passed","Tue Nov 16 01:38:27 GMT 2021","Tue Nov 16 01:41:34 GMT 2021","186898","","UI tests - A user can swap and mint tokens","","UI tests - A user can swap and mint tokens","As a User I can mint in more than one pool [ MGA - mETH ] [ MGA - newTokn ] and get invested values","As a User I can mint in more than one pool [ MGA - mETH ] [ MGA - newTokn ] and get invested values",""
"passed","Tue Nov 16 02:05:45 GMT 2021","Tue Nov 16 02:07:22 GMT 2021","97060","","UI tests - Extension management","","UI tests - Extension management","As a User I get feedback when extensions are installed and correctly setup","As a User I get feedback when extensions are installed and correctly setup",""
"failed","Tue Nov 16 01:45:32 GMT 2021","Tue Nov 16 01:45:33 GMT 2021","498","","UI tests - A user can use MAX:","","UI tests - A user can use MAX:","As a User I can mint All tokens newToken - newToken2","As a User I can mint All tokens newToken - newToken2",""
"passed","Tue Nov 16 01:32:52 GMT 2021","Tue Nov 16 01:35:30 GMT 2021","158639","","UI tests - A user can swap and mint tokens","","UI tests - A user can swap and mint tokens","As a User I can mint some tokens MGA - mETH","As a User I can mint some tokens MGA - mETH",""
"failed","Tue Nov 16 01:44:11 GMT 2021","Tue Nov 16 01:45:30 GMT 2021","78423","","UI main tests - Withdraw - ETH","","UI main tests - Withdraw - ETH","As a User I can Withdraw ETH from Meta extension","As a User I can Withdraw ETH from Meta extension",""
"passed","Tue Nov 16 02:07:30 GMT 2021","Tue Nov 16 02:08:00 GMT 2021","29932","","UI tests: Infra","","UI tests: Infra","Validate that Frontend retrieves AssetInfo data","Validate that Frontend retrieves AssetInfo data",""
"passed","Tue Nov 16 01:30:08 GMT 2021","Tue Nov 16 01:32:52 GMT 2021","163870","","UI tests - A user can swap and mint tokens","","UI tests - A user can swap and mint tokens","As a User I can Swap tokens - MGA - mETH","As a User I can Swap tokens - MGA - mETH",""
"passed","Tue Nov 16 01:54:41 GMT 2021","Tue Nov 16 01:57:05 GMT 2021","143942","","Accuracy tests","","Accuracy tests","As a User I get the right values for Pool investment P[5000000000000000000, 5000000000000000000] - I-> 0.123 -Expected - 0.123","As a User I get the right values for Pool investment P[5000000000000000000, 5000000000000000000] - I-> 0.123 -Expected - 0.123",""
"passed","Tue Nov 16 01:52:38 GMT 2021","Tue Nov 16 01:54:41 GMT 2021","123652","","Accuracy tests","","Accuracy tests","As a User I get the right values for Pool investment P[5000000000000000000, 100] - I-> 100000000000 -Expected - 0.000002","As a User I get the right values for Pool investment P[5000000000000000000, 100] - I-> 100000000000 -Expected - 0.000002",""
"failed","Tue Nov 16 01:45:34 GMT 2021","Tue Nov 16 01:45:35 GMT 2021","675","","UI tests - A user can see the new Modal","","UI tests - A user can see the new Modal","Modal contains currencies and amounts when providing liquidity","Modal contains currencies and amounts when providing liquidity",""
"passed","Tue Nov 16 02:02:37 GMT 2021","Tue Nov 16 02:05:28 GMT 2021","170793","","UI tests - Get Tokens from Faucet","","UI tests - Get Tokens from Faucet","As a User I can get test tokens from the faucet","As a User I can get test tokens from the faucet",""
"passed","Tue Nov 16 01:35:30 GMT 2021","Tue Nov 16 01:38:27 GMT 2021","176767","","UI tests - A user can swap and mint tokens","","UI tests - A user can swap and mint tokens","As a User I can burn all liquidity MGA - mETH","As a User I can burn all liquidity MGA - mETH",""
"failed","Tue Nov 16 01:45:32 GMT 2021","Tue Nov 16 01:45:32 GMT 2021","542","","UI tests - A user can use MAX:","","UI tests - A user can use MAX:","As a User I can Swap All MGA tokens -> newToken","As a User I can Swap All MGA tokens -> newToken",""
"passed","Tue Nov 16 02:05:29 GMT 2021","Tue Nov 16 02:05:45 GMT 2021","16257","","UI tests - Extension management","","UI tests - Extension management","As a User I get infomed whenever is neccesary to install any extension","As a User I get infomed whenever is neccesary to install any extension",""
"passed","Tue Nov 16 01:47:19 GMT 2021","Tue Nov 16 01:49:10 GMT 2021","111087","","Accuracy tests:","","Accuracy tests:","As a User I get the right values for Pool removal P[2499999999999999999, 5000000000000000000] - I-> 2 -Expected - 0.049 , 0.100","As a User I get the right values for Pool removal P[2499999999999999999, 5000000000000000000] - I-> 2 -Expected - 0.049 , 0.100",""
"failed","Tue Nov 16 01:45:35 GMT 2021","Tue Nov 16 01:45:35 GMT 2021","484","","UI tests - A user can see the new Modal","","UI tests - A user can see the new Modal","Modal is visible when burning liquidity","Modal is visible when burning liquidity",""
"passed","Tue Nov 16 01:41:42 GMT 2021","Tue Nov 16 01:44:11 GMT 2021","149262","","UI main tests - Deposit - ETH","","UI main tests - Deposit - ETH","As a User I can deposit ETH from Meta extension","As a User I can deposit ETH from Meta extension",""
"passed","Tue Nov 16 02:01:26 GMT 2021","Tue Nov 16 02:02:31 GMT 2021","64894","","UI tests - A user can create a pool MGA - newToken","","UI tests - A user can create a pool MGA - newToken","As a User I can create a pool","As a User I can create a pool",""
"passed","Tue Nov 16 01:49:10 GMT 2021","Tue Nov 16 01:51:16 GMT 2021","126032","","Accuracy tests:","","Accuracy tests:","As a User I get the right values for Pool removal P[2500000000000000000, 5000000000000000000] - I-> 1 -Expected - 0.025 , 0.05","As a User I get the right values for Pool removal P[2500000000000000000, 5000000000000000000] - I-> 1 -Expected - 0.025 , 0.05",""
"failed","Tue Nov 16 01:45:33 GMT 2021","Tue Nov 16 01:45:34 GMT 2021","549","","UI tests - A user can see the new Modal","","UI tests - A user can see the new Modal","Modal contains currencies and amounts when Swapping","Modal contains currencies and amounts when Swapping",""
"passed","Tue Nov 16 02:07:24 GMT 2021","Tue Nov 16 02:07:30 GMT 2021","5804","","UI tests: Infra","","UI tests: Infra","Validate that Mangata Frontend up and running","Validate that Mangata Frontend up and running",""
