"Status","Start Time","Stop Time","Duration in ms","Parent Suite","Suite","Sub Suite","Test Class","Test Method","Name","Description"
"failed","Sat May 21 03:53:57 GMT 2022","Sat May 21 03:57:39 GMT 2022","221276","","UI tests - Get Tokens from Faucet","","UI tests - Get Tokens from Faucet","As a User I can get test tokens from the faucet","As a User I can get test tokens from the faucet",""
"failed","Sat May 21 02:31:07 GMT 2022","Sat May 21 02:37:45 GMT 2022","397591","","UI tests - Extension management","","UI tests - Extension management","As a User I get feedback when extensions are installed and correctly setup","As a User I get feedback when extensions are installed and correctly setup",""
"failed","Sat May 21 01:40:00 GMT 2022","Sat May 21 01:45:00 GMT 2022","300004","","UI tests - A user can see the new Modal","","UI tests - A user can see the new Modal","Modal contains currencies and amounts when providing liquidity","Modal contains currencies and amounts when providing liquidity",""
"failed","Sat May 21 02:25:02 GMT 2022","Sat May 21 02:31:07 GMT 2022","364924","","UI tests - Extension management","","UI tests - Extension management","As a User I get infomed whenever is neccesary to install any extension","As a User I get infomed whenever is neccesary to install any extension",""
"passed","Sat May 21 03:57:39 GMT 2022","Sat May 21 03:57:42 GMT 2022","2694","","UI tests: Infra","","UI tests: Infra","Validate that Mangata Frontend up and running","Validate that Mangata Frontend up and running",""
"failed","Sat May 21 02:15:01 GMT 2022","Sat May 21 02:20:01 GMT 2022","300002","","UI tests - A user can swap and mint tokens","","UI tests - A user can swap and mint tokens","As a User I can burn all liquidity MGA - mETH","As a User I can burn all liquidity MGA - mETH",""
"failed","Sat May 21 01:55:00 GMT 2022","Sat May 21 02:00:00 GMT 2022","300004","","UI tests - A user gets notified when error","","UI tests - A user gets notified when error","When tx extrinsic - fails, User gets notified","When tx extrinsic - fails, User gets notified",""
"failed","Sat May 21 02:37:45 GMT 2022","Sat May 21 02:44:21 GMT 2022","396913","","UI tests - Extension management","","UI tests - Extension management","As a User I can switch between polkadot wallets","As a User I can switch between polkadot wallets",""
"failed","Sat May 21 02:00:00 GMT 2022","Sat May 21 02:05:00 GMT 2022","300003","","UI tests - A user gets notified when error","","UI tests - A user gets notified when error","When user cancel a TX, User gets notified","When user cancel a TX, User gets notified",""
"failed","Sat May 21 01:45:00 GMT 2022","Sat May 21 01:50:00 GMT 2022","300004","","UI tests - A user can see the new Modal","","UI tests - A user can see the new Modal","Modal is visible when burning liquidity","Modal is visible when burning liquidity",""
"failed","Sat May 21 03:24:44 GMT 2022","Sat May 21 03:24:44 GMT 2022","12","","UI main tests - Withdraw - ETH","","UI main tests - Withdraw - ETH","As a User I can Withdraw ETH from Meta extension","As a User I can Withdraw ETH from Meta extension",""
"failed","Sat May 21 03:39:48 GMT 2022","Sat May 21 03:39:48 GMT 2022","6","","Accuracy tests","","Accuracy tests","As a User I get the right values for Pool investment P[5000000000000000000, 100] - I-> 100000000000 -Expected - 0.000002","As a User I get the right values for Pool investment P[5000000000000000000, 100] - I-> 100000000000 -Expected - 0.000002",""
"failed","Sat May 21 02:20:01 GMT 2022","Sat May 21 02:25:01 GMT 2022","300004","","UI tests - A user can swap and mint tokens","","UI tests - A user can swap and mint tokens","As a User I can mint in more than one pool [ MGA - mETH ] [ MGA - newTokn ] and get invested values","As a User I can mint in more than one pool [ MGA - mETH ] [ MGA - newTokn ] and get invested values",""
"failed","Sat May 21 02:05:01 GMT 2022","Sat May 21 02:10:01 GMT 2022","300022","","UI tests - A user can swap and mint tokens","","UI tests - A user can swap and mint tokens","As a User I can Swap tokens - MGA - mETH","As a User I can Swap tokens - MGA - mETH",""
"failed","Sat May 21 03:57:42 GMT 2022","Sat May 21 03:57:56 GMT 2022","13878","","UI tests: Infra","","UI tests: Infra","Validate that Frontend retrieves AssetInfo data","Validate that Frontend retrieves AssetInfo data",""
"failed","Sat May 21 03:29:47 GMT 2022","Sat May 21 03:34:47 GMT 2022","300022","","UI tests - A user swapping tokens:","","UI tests - A user swapping tokens:","Token amounts are correectly propagated to the node","Token amounts are correectly propagated to the node",""
"failed","Sat May 21 03:39:48 GMT 2022","Sat May 21 03:39:48 GMT 2022","1","","Accuracy tests","","Accuracy tests","As a User I get the right values for Pool investment P[5000000000000000000, 5000000000000000000] - I-> 0.123 -Expected - 0.123","As a User I get the right values for Pool investment P[5000000000000000000, 5000000000000000000] - I-> 0.123 -Expected - 0.123",""
"skipped","Sat May 21 03:02:37 GMT 2022","Sat May 21 03:02:37 GMT 2022","0","","UI tests > Balances","","UI tests > Balances","As a User I can see the min/max when withdrawing","As a User I can see the min/max when withdrawing",""
"failed","Sat May 21 03:39:48 GMT 2022","Sat May 21 03:39:48 GMT 2022","1","","Accuracy tests","","Accuracy tests","As a User I get the right values for Pool investment P[2500000000000000000, 5000000000000000000] - I-> 0.100 -Expected - 0.200","As a User I get the right values for Pool investment P[2500000000000000000, 5000000000000000000] - I-> 0.100 -Expected - 0.200",""
"failed","Sat May 21 03:46:26 GMT 2022","Sat May 21 03:46:26 GMT 2022","172","","UI tests - A user can create a pool MGA - newToken","","UI tests - A user can create a pool MGA - newToken","As a User I can create a pool","As a User I can create a pool",""
"failed","Sat May 21 02:10:01 GMT 2022","Sat May 21 02:15:01 GMT 2022","300003","","UI tests - A user can swap and mint tokens","","UI tests - A user can swap and mint tokens","As a User I can mint some tokens MGA - mETH","As a User I can mint some tokens MGA - mETH",""
"failed","Sat May 21 03:29:46 GMT 2022","Sat May 21 03:29:46 GMT 2022","2","","Accuracy tests:","","Accuracy tests:","As a User I get the right values for Pool removal P[2500000000000000000, 5000000000000000000] - I-> 1 -Expected - 0.025 , 0.05","As a User I get the right values for Pool removal P[2500000000000000000, 5000000000000000000] - I-> 1 -Expected - 0.025 , 0.05",""
"failed","Sat May 21 01:35:00 GMT 2022","Sat May 21 01:40:00 GMT 2022","300028","","UI tests - A user can see the new Modal","","UI tests - A user can see the new Modal","Modal contains currencies and amounts when Swapping","Modal contains currencies and amounts when Swapping",""
"failed","Sat May 21 03:29:46 GMT 2022","Sat May 21 03:29:46 GMT 2022","5","","Accuracy tests:","","Accuracy tests:","As a User I get the right values for Pool removal P[2499999999999999999, 5000000000000000000] - I-> 2 -Expected - 0.049 , 0.100","As a User I get the right values for Pool removal P[2499999999999999999, 5000000000000000000] - I-> 2 -Expected - 0.049 , 0.100",""
"failed","Sat May 21 01:50:00 GMT 2022","Sat May 21 01:55:00 GMT 2022","300005","","UI tests - A user gets notified when error","","UI tests - A user gets notified when error","When tx front - fails, User gets notified","When tx front - fails, User gets notified",""
"failed","Sat May 21 03:12:40 GMT 2022","Sat May 21 03:14:44 GMT 2022","123992","","UI main tests - Deposit - ETH","","UI main tests - Deposit - ETH","As a User I can deposit ETH from Meta extension","As a User I can deposit ETH from Meta extension",""
"failed","Sat May 21 03:02:37 GMT 2022","Sat May 21 03:02:37 GMT 2022","3","","UI tests > Balances","","UI tests > Balances","As a User I can see the max possible value in UI","As a User I can see the max possible value in UI",""
"failed","Sat May 21 03:24:45 GMT 2022","Sat May 21 03:24:45 GMT 2022","40","","UI tests - A user can use MAX:","","UI tests - A user can use MAX:","As a User I can Swap All MGA tokens -> newToken","As a User I can Swap All MGA tokens -> newToken",""
"failed","Sat May 21 02:50:59 GMT 2022","Sat May 21 02:57:36 GMT 2022","397231","","UI tests - Extension management","","UI tests - Extension management","As a User I can not see hidden wallets in the modal","As a User I can not see hidden wallets in the modal",""
"failed","Sat May 21 02:44:21 GMT 2022","Sat May 21 02:50:59 GMT 2022","397104","","UI tests - Extension management","","UI tests - Extension management","As a User I can switch between polkadot wallets using the modal","As a User I can switch between polkadot wallets using the modal",""
"failed","Sat May 21 03:02:37 GMT 2022","Sat May 21 03:02:37 GMT 2022","2","","UI tests > Balances","","UI tests > Balances","As a User I can see the min value in UI","As a User I can see the min value in UI",""
"failed","Sat May 21 03:24:45 GMT 2022","Sat May 21 03:24:45 GMT 2022","5","","UI tests - A user can use MAX:","","UI tests - A user can use MAX:","As a User I can mint All tokens newToken - newToken2","As a User I can mint All tokens newToken - newToken2",""
