"Status","Start Time","Stop Time","Duration in ms","Parent Suite","Suite","Sub Suite","Test Class","Test Method","Name","Description"
"passed","Thu Dec 16 01:31:59 GMT 2021","Thu Dec 16 01:33:57 GMT 2021","118252","","UI tests - A user can see the new Modal","","UI tests - A user can see the new Modal","Modal contains currencies and amounts when providing liquidity","Modal contains currencies and amounts when providing liquidity",""
"failed","Thu Dec 16 01:56:38 GMT 2021","Thu Dec 16 02:00:00 GMT 2021","202086","","UI tests - A user can use MAX:","","UI tests - A user can use MAX:","As a User I can Swap All MGA tokens -> newToken","As a User I can Swap All MGA tokens -> newToken",""
"passed","Thu Dec 16 01:29:53 GMT 2021","Thu Dec 16 01:31:59 GMT 2021","125070","","UI tests - A user can see the new Modal","","UI tests - A user can see the new Modal","Modal contains currencies and amounts when Swapping","Modal contains currencies and amounts when Swapping",""
"passed","Thu Dec 16 01:41:50 GMT 2021","Thu Dec 16 01:44:12 GMT 2021","142365","","UI tests - A user can swap and mint tokens","","UI tests - A user can swap and mint tokens","As a User I can mint some tokens MGA - mETH","As a User I can mint some tokens MGA - mETH",""
"passed","Thu Dec 16 01:33:57 GMT 2021","Thu Dec 16 01:36:30 GMT 2021","153080","","UI tests - A user can see the new Modal","","UI tests - A user can see the new Modal","Modal is visible when burning liquidity","Modal is visible when burning liquidity",""
"failed","Thu Dec 16 01:46:56 GMT 2021","Thu Dec 16 01:49:54 GMT 2021","177810","","UI tests - A user can swap and mint tokens","","UI tests - A user can swap and mint tokens","As a User I can mint in more than one pool [ MGA - mETH ] [ MGA - newTokn ] and get invested values","As a User I can mint in more than one pool [ MGA - mETH ] [ MGA - newTokn ] and get invested values",""
"failed","Thu Dec 16 01:54:02 GMT 2021","Thu Dec 16 01:56:06 GMT 2021","123875","","UI main tests - Deposit - ETH","","UI main tests - Deposit - ETH","As a User I can deposit ETH from Meta extension","As a User I can deposit ETH from Meta extension",""
"skipped","Thu Dec 16 01:53:56 GMT 2021","Thu Dec 16 01:53:56 GMT 2021","0","","UI tests > Balances","","UI tests > Balances","As a User I can see the min/max when withdrawing","As a User I can see the min/max when withdrawing",""
"passed","Thu Dec 16 01:52:55 GMT 2021","Thu Dec 16 01:53:25 GMT 2021","30348","","UI tests > Balances","","UI tests > Balances","As a User I can see the max possible value in UI","As a User I can see the max possible value in UI",""
"failed","Thu Dec 16 02:00:00 GMT 2021","Thu Dec 16 02:03:08 GMT 2021","187681","","UI tests - A user can use MAX:","","UI tests - A user can use MAX:","As a User I can mint All tokens newToken - newToken2","As a User I can mint All tokens newToken - newToken2",""
"failed","Thu Dec 16 01:38:23 GMT 2021","Thu Dec 16 01:39:19 GMT 2021","56077","","UI tests - A user gets notified when error","","UI tests - A user gets notified when error","When user cancel a TX, User gets notified","When user cancel a TX, User gets notified",""
"passed","Thu Dec 16 01:39:20 GMT 2021","Thu Dec 16 01:41:50 GMT 2021","149223","","UI tests - A user can swap and mint tokens","","UI tests - A user can swap and mint tokens","As a User I can Swap tokens - MGA - mETH","As a User I can Swap tokens - MGA - mETH",""
"passed","Thu Dec 16 02:39:08 GMT 2021","Thu Dec 16 02:39:59 GMT 2021","51055","","UI tests: Infra","","UI tests: Infra","Validate that Frontend retrieves AssetInfo data","Validate that Frontend retrieves AssetInfo data",""
"failed","Thu Dec 16 02:04:26 GMT 2021","Thu Dec 16 02:07:38 GMT 2021","191997","","Accuracy tests:","","Accuracy tests:","As a User I get the right values for Pool removal P[2499999999999999999, 5000000000000000000] - I-> 2 -Expected - 0.049 , 0.100","As a User I get the right values for Pool removal P[2499999999999999999, 5000000000000000000] - I-> 2 -Expected - 0.049 , 0.100",""
"failed","Thu Dec 16 01:56:06 GMT 2021","Thu Dec 16 01:56:37 GMT 2021","31438","","UI main tests - Withdraw - ETH","","UI main tests - Withdraw - ETH","As a User I can Withdraw ETH from Meta extension","As a User I can Withdraw ETH from Meta extension",""
"passed","Thu Dec 16 02:37:40 GMT 2021","Thu Dec 16 02:39:05 GMT 2021","84721","","UI tests - Extension management","","UI tests - Extension management","As a User I get feedback when extensions are installed and correctly setup","As a User I get feedback when extensions are installed and correctly setup",""
"failed","Thu Dec 16 02:17:27 GMT 2021","Thu Dec 16 02:19:56 GMT 2021","149418","","Accuracy tests","","Accuracy tests","As a User I get the right values for Pool investment P[2500000000000000000, 5000000000000000000] - I-> 0.100 -Expected - 0.200","As a User I get the right values for Pool investment P[2500000000000000000, 5000000000000000000] - I-> 0.100 -Expected - 0.200",""
"failed","Thu Dec 16 02:07:38 GMT 2021","Thu Dec 16 02:10:09 GMT 2021","151258","","Accuracy tests:","","Accuracy tests:","As a User I get the right values for Pool removal P[2500000000000000000, 5000000000000000000] - I-> 1 -Expected - 0.025 , 0.05","As a User I get the right values for Pool removal P[2500000000000000000, 5000000000000000000] - I-> 1 -Expected - 0.025 , 0.05",""
"passed","Thu Dec 16 02:37:25 GMT 2021","Thu Dec 16 02:37:40 GMT 2021","14608","","UI tests - Extension management","","UI tests - Extension management","As a User I get infomed whenever is neccesary to install any extension","As a User I get infomed whenever is neccesary to install any extension",""
"failed","Thu Dec 16 02:25:49 GMT 2021","Thu Dec 16 02:26:44 GMT 2021","55071","","UI tests - A user can create a pool MGA - newToken","","UI tests - A user can create a pool MGA - newToken","As a User I can create a pool","As a User I can create a pool",""
"failed","Thu Dec 16 01:36:30 GMT 2021","Thu Dec 16 01:37:27 GMT 2021","56865","","UI tests - A user gets notified when error","","UI tests - A user gets notified when error","When tx front - fails, User gets notified","When tx front - fails, User gets notified",""
"failed","Thu Dec 16 02:14:51 GMT 2021","Thu Dec 16 02:17:27 GMT 2021","156411","","Accuracy tests","","Accuracy tests","As a User I get the right values for Pool investment P[5000000000000000000, 5000000000000000000] - I-> 0.123 -Expected - 0.123","As a User I get the right values for Pool investment P[5000000000000000000, 5000000000000000000] - I-> 0.123 -Expected - 0.123",""
"failed","Thu Dec 16 02:12:19 GMT 2021","Thu Dec 16 02:14:51 GMT 2021","151898","","Accuracy tests","","Accuracy tests","As a User I get the right values for Pool investment P[5000000000000000000, 100] - I-> 100000000000 -Expected - 0.000002","As a User I get the right values for Pool investment P[5000000000000000000, 100] - I-> 100000000000 -Expected - 0.000002",""
"passed","Thu Dec 16 01:44:12 GMT 2021","Thu Dec 16 01:46:56 GMT 2021","163919","","UI tests - A user can swap and mint tokens","","UI tests - A user can swap and mint tokens","As a User I can burn all liquidity MGA - mETH","As a User I can burn all liquidity MGA - mETH",""
"passed","Thu Dec 16 02:39:06 GMT 2021","Thu Dec 16 02:39:08 GMT 2021","2490","","UI tests: Infra","","UI tests: Infra","Validate that Mangata Frontend up and running","Validate that Mangata Frontend up and running",""
"passed","Thu Dec 16 01:53:25 GMT 2021","Thu Dec 16 01:53:56 GMT 2021","30537","","UI tests > Balances","","UI tests > Balances","As a User I can see the min value in UI","As a User I can see the min value in UI",""
"failed","Thu Dec 16 02:31:08 GMT 2021","Thu Dec 16 02:37:24 GMT 2021","376567","","UI tests - Get Tokens from Faucet","","UI tests - Get Tokens from Faucet","As a User I can get test tokens from the faucet","As a User I can get test tokens from the faucet",""
"failed","Thu Dec 16 01:37:27 GMT 2021","Thu Dec 16 01:38:23 GMT 2021","56363","","UI tests - A user gets notified when error","","UI tests - A user gets notified when error","When tx extrinsic - fails, User gets notified","When tx extrinsic - fails, User gets notified",""
