"Status","Start Time","Stop Time","Duration in ms","Parent Suite","Suite","Sub Suite","Test Class","Test Method","Name","Description"
"passed","Fri Nov 12 14:03:00 GMT 2021","Fri Nov 12 14:05:50 GMT 2021","169554","","Accuracy tests","","Accuracy tests","As a User I get the right values for Pool investment P[5000000000000000000, 5000000000000000000] - I-> 0.123 -Expected - 0.123","As a User I get the right values for Pool investment P[5000000000000000000, 5000000000000000000] - I-> 0.123 -Expected - 0.123",""
"passed","Fri Nov 12 13:30:06 GMT 2021","Fri Nov 12 13:34:24 GMT 2021","258125","","UI main tests - Withdraw - ETH","","UI main tests - Withdraw - ETH","As a User I can Withdraw ETH from Meta extension","As a User I can Withdraw ETH from Meta extension",""
"passed","Fri Nov 12 14:19:45 GMT 2021","Fri Nov 12 14:19:50 GMT 2021","4331","","UI tests: Infra","","UI tests: Infra","Validate that Mangata Frontend up and running","Validate that Mangata Frontend up and running",""
"passed","Fri Nov 12 13:22:35 GMT 2021","Fri Nov 12 13:26:01 GMT 2021","205805","","UI tests - A user can swap and mint tokens","","UI tests - A user can swap and mint tokens","As a User I can mint in more than one pool [ MGA - mETH ] [ MGA - newTokn ] and get invested values","As a User I can mint in more than one pool [ MGA - mETH ] [ MGA - newTokn ] and get invested values",""
"failed","Fri Nov 12 13:38:18 GMT 2021","Fri Nov 12 13:42:48 GMT 2021","269752","","UI tests - A user can use MAX:","","UI tests - A user can use MAX:","As a User I can mint All tokens newToken - newToken2","As a User I can mint All tokens newToken - newToken2",""
"passed","Fri Nov 12 14:16:43 GMT 2021","Fri Nov 12 14:16:57 GMT 2021","13683","","UI tests - Extension management","","UI tests - Extension management","As a User I get infomed whenever is neccesary to install any extension","As a User I get infomed whenever is neccesary to install any extension",""
"passed","Fri Nov 12 14:00:31 GMT 2021","Fri Nov 12 14:03:00 GMT 2021","149152","","Accuracy tests","","Accuracy tests","As a User I get the right values for Pool investment P[5000000000000000000, 100] - I-> 100000000000 -Expected - 0.000002","As a User I get the right values for Pool investment P[5000000000000000000, 100] - I-> 100000000000 -Expected - 0.000002",""
"passed","Fri Nov 12 13:16:00 GMT 2021","Fri Nov 12 13:19:18 GMT 2021","198143","","UI tests - A user can swap and mint tokens","","UI tests - A user can swap and mint tokens","As a User I can mint some tokens MGA - mETH","As a User I can mint some tokens MGA - mETH",""
"passed","Fri Nov 12 14:16:57 GMT 2021","Fri Nov 12 14:19:43 GMT 2021","166719","","UI tests - Extension management","","UI tests - Extension management","As a User I get feedback when extensions are installed and correctly setup","As a User I get feedback when extensions are installed and correctly setup",""
"passed","Fri Nov 12 13:19:18 GMT 2021","Fri Nov 12 13:22:35 GMT 2021","196819","","UI tests - A user can swap and mint tokens","","UI tests - A user can swap and mint tokens","As a User I can burn all liquidity MGA - mETH","As a User I can burn all liquidity MGA - mETH",""
"passed","Fri Nov 12 13:45:31 GMT 2021","Fri Nov 12 13:48:26 GMT 2021","175254","","UI tests - A user can see the new Modal","","UI tests - A user can see the new Modal","Modal contains currencies and amounts when providing liquidity","Modal contains currencies and amounts when providing liquidity",""
"passed","Fri Nov 12 14:10:44 GMT 2021","Fri Nov 12 14:12:43 GMT 2021","119446","","UI tests - A user can create a pool MGA - newToken","","UI tests - A user can create a pool MGA - newToken","As a User I can create a pool","As a User I can create a pool",""
"passed","Fri Nov 12 13:53:07 GMT 2021","Fri Nov 12 13:55:26 GMT 2021","138700","","Accuracy tests:","","Accuracy tests:","As a User I get the right values for Pool removal P[2499999999999999999, 5000000000000000000] - I-> 2 -Expected - 0.049 , 0.100","As a User I get the right values for Pool removal P[2499999999999999999, 5000000000000000000] - I-> 2 -Expected - 0.049 , 0.100",""
"passed","Fri Nov 12 13:48:26 GMT 2021","Fri Nov 12 13:51:49 GMT 2021","202840","","UI tests - A user can see the new Modal","","UI tests - A user can see the new Modal","Modal is visible when burning liquidity","Modal is visible when burning liquidity",""
"passed","Fri Nov 12 14:19:50 GMT 2021","Fri Nov 12 14:21:06 GMT 2021","76140","","UI tests: Infra","","UI tests: Infra","Validate that Frontend retrieves AssetInfo data","Validate that Frontend retrieves AssetInfo data",""
"failed","Fri Nov 12 13:12:42 GMT 2021","Fri Nov 12 13:16:00 GMT 2021","197905","","UI tests - A user can swap and mint tokens","","UI tests - A user can swap and mint tokens","As a User I can Swap tokens - MGA - mETH","As a User I can Swap tokens - MGA - mETH",""
"passed","Fri Nov 12 13:26:08 GMT 2021","Fri Nov 12 13:30:06 GMT 2021","237893","","UI main tests - Deposit - ETH","","UI main tests - Deposit - ETH","As a User I can deposit ETH from Meta extension","As a User I can deposit ETH from Meta extension",""
"passed","Fri Nov 12 13:42:49 GMT 2021","Fri Nov 12 13:45:31 GMT 2021","161212","","UI tests - A user can see the new Modal","","UI tests - A user can see the new Modal","Modal contains currencies and amounts when Swapping","Modal contains currencies and amounts when Swapping",""
"failed","Fri Nov 12 13:55:26 GMT 2021","Fri Nov 12 13:58:44 GMT 2021","197788","","Accuracy tests:","","Accuracy tests:","As a User I get the right values for Pool removal P[2500000000000000000, 5000000000000000000] - I-> 1 -Expected - 0.025 , 0.05","As a User I get the right values for Pool removal P[2500000000000000000, 5000000000000000000] - I-> 1 -Expected - 0.025 , 0.05",""
"passed","Fri Nov 12 14:05:50 GMT 2021","Fri Nov 12 14:08:32 GMT 2021","162241","","Accuracy tests","","Accuracy tests","As a User I get the right values for Pool investment P[2500000000000000000, 5000000000000000000] - I-> 0.100 -Expected - 0.200","As a User I get the right values for Pool investment P[2500000000000000000, 5000000000000000000] - I-> 0.100 -Expected - 0.200",""
"failed","Fri Nov 12 13:34:26 GMT 2021","Fri Nov 12 13:38:18 GMT 2021","232043","","UI tests - A user can use MAX:","","UI tests - A user can use MAX:","As a User I can Swap All MGA tokens -> newToken","As a User I can Swap All MGA tokens -> newToken",""
"passed","Fri Nov 12 14:12:47 GMT 2021","Fri Nov 12 14:16:42 GMT 2021","234414","","UI tests - Get Tokens from Faucet","","UI tests - Get Tokens from Faucet","As a User I can get test tokens from the faucet","As a User I can get test tokens from the faucet",""
