"Status","Start Time","Stop Time","Duration in ms","Parent Suite","Suite","Sub Suite","Test Class","Test Method","Name","Description"
"failed","Wed Sep 22 13:17:40 GMT 2021","Wed Sep 22 13:17:40 GMT 2021","1","","UI tests - A user can swap and mint tokens","","UI tests - A user can swap and mint tokens","As a User I can mint in more than one pool [ MGA - mETH ] [ MGA - newTokn ] and get invested values","As a User I can mint in more than one pool [ MGA - mETH ] [ MGA - newTokn ] and get invested values",""
"failed","Wed Sep 22 13:17:40 GMT 2021","Wed Sep 22 13:17:40 GMT 2021","3","","UI tests - A user can swap and mint tokens","","UI tests - A user can swap and mint tokens","As a User I can Swap tokens - MGA - mETH","As a User I can Swap tokens - MGA - mETH",""
"failed","Wed Sep 22 13:17:43 GMT 2021","Wed Sep 22 13:17:44 GMT 2021","479","","UI main tests - Deposit - ETH","","UI main tests - Deposit - ETH","As a User I can deposit ETH from Meta extension","As a User I can deposit ETH from Meta extension",""
"failed","Wed Sep 22 13:17:44 GMT 2021","Wed Sep 22 13:17:44 GMT 2021","2","","UI main tests - Withdraw - ETH","","UI main tests - Withdraw - ETH","As a User I can Withdraw ETH from Meta extension","As a User I can Withdraw ETH from Meta extension",""
"failed","Wed Sep 22 13:17:40 GMT 2021","Wed Sep 22 13:17:40 GMT 2021","1","","UI tests - A user can swap and mint tokens","","UI tests - A user can swap and mint tokens","As a User I can mint some tokens MGA - mETH","As a User I can mint some tokens MGA - mETH",""
"failed","Wed Sep 22 13:17:40 GMT 2021","Wed Sep 22 13:17:40 GMT 2021","1","","UI tests - A user can swap and mint tokens","","UI tests - A user can swap and mint tokens","As a User I can burn all liquidity MGA - mETH","As a User I can burn all liquidity MGA - mETH",""
