"Status","Start Time","Stop Time","Duration in ms","Parent Suite","Suite","Sub Suite","Test Class","Test Method","Name","Description"
"passed","Tue May 24 04:01:46 GMT 2022","Tue May 24 04:01:49 GMT 2022","2623","","UI tests: Infra","","UI tests: Infra","Validate that Mangata Frontend up and running","Validate that Mangata Frontend up and running",""
"failed","Tue May 24 02:14:06 GMT 2022","Tue May 24 02:19:06 GMT 2022","300003","","UI tests - A user can swap and mint tokens","","UI tests - A user can swap and mint tokens","As a User I can mint some tokens MGA - mETH","As a User I can mint some tokens MGA - mETH",""
"failed","Tue May 24 03:28:51 GMT 2022","Tue May 24 03:28:52 GMT 2022","31","","UI tests - A user can use MAX:","","UI tests - A user can use MAX:","As a User I can Swap All MGA tokens -> newToken","As a User I can Swap All MGA tokens -> newToken",""
"failed","Tue May 24 03:43:54 GMT 2022","Tue May 24 03:43:54 GMT 2022","8","","Accuracy tests","","Accuracy tests","As a User I get the right values for Pool investment P[5000000000000000000, 100] - I-> 100000000000 -Expected - 0.000002","As a User I get the right values for Pool investment P[5000000000000000000, 100] - I-> 100000000000 -Expected - 0.000002",""
"failed","Tue May 24 02:04:04 GMT 2022","Tue May 24 02:09:04 GMT 2022","300004","","UI tests - A user gets notified when error","","UI tests - A user gets notified when error","When user cancel a TX, User gets notified","When user cancel a TX, User gets notified",""
"failed","Tue May 24 03:16:46 GMT 2022","Tue May 24 03:18:50 GMT 2022","124307","","UI main tests - Deposit - ETH","","UI main tests - Deposit - ETH","As a User I can deposit ETH from Meta extension","As a User I can deposit ETH from Meta extension",""
"failed","Tue May 24 03:33:52 GMT 2022","Tue May 24 03:33:52 GMT 2022","6","","Accuracy tests:","","Accuracy tests:","As a User I get the right values for Pool removal P[2499999999999999999, 5000000000000000000] - I-> 2 -Expected - 0.049 , 0.100","As a User I get the right values for Pool removal P[2499999999999999999, 5000000000000000000] - I-> 2 -Expected - 0.049 , 0.100",""
"failed","Tue May 24 01:49:04 GMT 2022","Tue May 24 01:54:04 GMT 2022","300002","","UI tests - A user can see the new Modal","","UI tests - A user can see the new Modal","Modal is visible when burning liquidity","Modal is visible when burning liquidity",""
"failed","Tue May 24 03:06:43 GMT 2022","Tue May 24 03:06:43 GMT 2022","3","","UI tests > Balances","","UI tests > Balances","As a User I can see the max possible value in UI","As a User I can see the max possible value in UI",""
"failed","Tue May 24 04:01:49 GMT 2022","Tue May 24 04:02:03 GMT 2022","13877","","UI tests: Infra","","UI tests: Infra","Validate that Frontend retrieves AssetInfo data","Validate that Frontend retrieves AssetInfo data",""
"failed","Tue May 24 03:58:05 GMT 2022","Tue May 24 04:01:45 GMT 2022","219799","","UI tests - Get Tokens from Faucet","","UI tests - Get Tokens from Faucet","As a User I can get test tokens from the faucet","As a User I can get test tokens from the faucet",""
"failed","Tue May 24 02:35:11 GMT 2022","Tue May 24 02:41:48 GMT 2022","396900","","UI tests - Extension management","","UI tests - Extension management","As a User I get feedback when extensions are installed and correctly setup","As a User I get feedback when extensions are installed and correctly setup",""
"failed","Tue May 24 03:43:54 GMT 2022","Tue May 24 03:43:54 GMT 2022","1","","Accuracy tests","","Accuracy tests","As a User I get the right values for Pool investment P[5000000000000000000, 5000000000000000000] - I-> 0.123 -Expected - 0.123","As a User I get the right values for Pool investment P[5000000000000000000, 5000000000000000000] - I-> 0.123 -Expected - 0.123",""
"failed","Tue May 24 03:33:53 GMT 2022","Tue May 24 03:38:53 GMT 2022","300023","","UI tests - A user swapping tokens:","","UI tests - A user swapping tokens:","Token amounts are correectly propagated to the node","Token amounts are correectly propagated to the node",""
"failed","Tue May 24 03:28:52 GMT 2022","Tue May 24 03:28:52 GMT 2022","6","","UI tests - A user can use MAX:","","UI tests - A user can use MAX:","As a User I can mint All tokens newToken - newToken2","As a User I can mint All tokens newToken - newToken2",""
"failed","Tue May 24 03:06:43 GMT 2022","Tue May 24 03:06:43 GMT 2022","1","","UI tests > Balances","","UI tests > Balances","As a User I can see the min value in UI","As a User I can see the min value in UI",""
"failed","Tue May 24 02:19:06 GMT 2022","Tue May 24 02:24:06 GMT 2022","300003","","UI tests - A user can swap and mint tokens","","UI tests - A user can swap and mint tokens","As a User I can burn all liquidity MGA - mETH","As a User I can burn all liquidity MGA - mETH",""
"failed","Tue May 24 01:39:04 GMT 2022","Tue May 24 01:44:04 GMT 2022","300031","","UI tests - A user can see the new Modal","","UI tests - A user can see the new Modal","Modal contains currencies and amounts when Swapping","Modal contains currencies and amounts when Swapping",""
"failed","Tue May 24 02:24:06 GMT 2022","Tue May 24 02:29:06 GMT 2022","300004","","UI tests - A user can swap and mint tokens","","UI tests - A user can swap and mint tokens","As a User I can mint in more than one pool [ MGA - mETH ] [ MGA - newTokn ] and get invested values","As a User I can mint in more than one pool [ MGA - mETH ] [ MGA - newTokn ] and get invested values",""
"failed","Tue May 24 02:55:03 GMT 2022","Tue May 24 03:01:41 GMT 2022","397943","","UI tests - Extension management","","UI tests - Extension management","As a User I can not see hidden wallets in the modal","As a User I can not see hidden wallets in the modal",""
"failed","Tue May 24 03:33:52 GMT 2022","Tue May 24 03:33:52 GMT 2022","3","","Accuracy tests:","","Accuracy tests:","As a User I get the right values for Pool removal P[2500000000000000000, 5000000000000000000] - I-> 1 -Expected - 0.025 , 0.05","As a User I get the right values for Pool removal P[2500000000000000000, 5000000000000000000] - I-> 1 -Expected - 0.025 , 0.05",""
"failed","Tue May 24 03:28:50 GMT 2022","Tue May 24 03:28:50 GMT 2022","9","","UI main tests - Withdraw - ETH","","UI main tests - Withdraw - ETH","As a User I can Withdraw ETH from Meta extension","As a User I can Withdraw ETH from Meta extension",""
"failed","Tue May 24 02:48:25 GMT 2022","Tue May 24 02:55:03 GMT 2022","398372","","UI tests - Extension management","","UI tests - Extension management","As a User I can switch between polkadot wallets using the modal","As a User I can switch between polkadot wallets using the modal",""
"failed","Tue May 24 03:43:54 GMT 2022","Tue May 24 03:43:54 GMT 2022","1","","Accuracy tests","","Accuracy tests","As a User I get the right values for Pool investment P[2500000000000000000, 5000000000000000000] - I-> 0.100 -Expected - 0.200","As a User I get the right values for Pool investment P[2500000000000000000, 5000000000000000000] - I-> 0.100 -Expected - 0.200",""
"failed","Tue May 24 03:50:34 GMT 2022","Tue May 24 03:50:34 GMT 2022","220","","UI tests - A user can create a pool MGA - newToken","","UI tests - A user can create a pool MGA - newToken","As a User I can create a pool","As a User I can create a pool",""
"failed","Tue May 24 01:44:04 GMT 2022","Tue May 24 01:49:04 GMT 2022","300003","","UI tests - A user can see the new Modal","","UI tests - A user can see the new Modal","Modal contains currencies and amounts when providing liquidity","Modal contains currencies and amounts when providing liquidity",""
"failed","Tue May 24 02:41:48 GMT 2022","Tue May 24 02:48:25 GMT 2022","397400","","UI tests - Extension management","","UI tests - Extension management","As a User I can switch between polkadot wallets","As a User I can switch between polkadot wallets",""
"failed","Tue May 24 02:09:06 GMT 2022","Tue May 24 02:14:06 GMT 2022","300024","","UI tests - A user can swap and mint tokens","","UI tests - A user can swap and mint tokens","As a User I can Swap tokens - MGA - mETH","As a User I can Swap tokens - MGA - mETH",""
"failed","Tue May 24 01:54:04 GMT 2022","Tue May 24 01:59:04 GMT 2022","300005","","UI tests - A user gets notified when error","","UI tests - A user gets notified when error","When tx front - fails, User gets notified","When tx front - fails, User gets notified",""
"skipped","Tue May 24 03:06:43 GMT 2022","Tue May 24 03:06:43 GMT 2022","0","","UI tests > Balances","","UI tests > Balances","As a User I can see the min/max when withdrawing","As a User I can see the min/max when withdrawing",""
"failed","Tue May 24 02:29:07 GMT 2022","Tue May 24 02:35:11 GMT 2022","364047","","UI tests - Extension management","","UI tests - Extension management","As a User I get infomed whenever is neccesary to install any extension","As a User I get infomed whenever is neccesary to install any extension",""
"failed","Tue May 24 01:59:04 GMT 2022","Tue May 24 02:04:04 GMT 2022","300003","","UI tests - A user gets notified when error","","UI tests - A user gets notified when error","When tx extrinsic - fails, User gets notified","When tx extrinsic - fails, User gets notified",""
