"Status","Start Time","Stop Time","Duration in ms","Parent Suite","Suite","Sub Suite","Test Class","Test Method","Name","Description"
"passed","Sat Nov 13 01:54:29 GMT 2021","Sat Nov 13 01:56:27 GMT 2021","118301","","Accuracy tests","","Accuracy tests","As a User I get the right values for Pool investment P[2500000000000000000, 5000000000000000000] - I-> 0.100 -Expected - 0.200","As a User I get the right values for Pool investment P[2500000000000000000, 5000000000000000000] - I-> 0.100 -Expected - 0.200",""
"passed","Sat Nov 13 01:50:44 GMT 2021","Sat Nov 13 01:52:34 GMT 2021","110669","","Accuracy tests","","Accuracy tests","As a User I get the right values for Pool investment P[5000000000000000000, 100] - I-> 100000000000 -Expected - 0.000002","As a User I get the right values for Pool investment P[5000000000000000000, 100] - I-> 100000000000 -Expected - 0.000002",""
"passed","Sat Nov 13 01:30:32 GMT 2021","Sat Nov 13 01:33:00 GMT 2021","148044","","UI tests - A user can swap and mint tokens","","UI tests - A user can swap and mint tokens","As a User I can mint some tokens MGA - mETH","As a User I can mint some tokens MGA - mETH",""
"passed","Sat Nov 13 01:41:04 GMT 2021","Sat Nov 13 01:43:37 GMT 2021","152921","","UI main tests - Withdraw - ETH","","UI main tests - Withdraw - ETH","As a User I can Withdraw ETH from Meta extension","As a User I can Withdraw ETH from Meta extension",""
"passed","Sat Nov 13 01:38:55 GMT 2021","Sat Nov 13 01:41:04 GMT 2021","129250","","UI main tests - Deposit - ETH","","UI main tests - Deposit - ETH","As a User I can deposit ETH from Meta extension","As a User I can deposit ETH from Meta extension",""
"passed","Sat Nov 13 01:58:19 GMT 2021","Sat Nov 13 01:59:12 GMT 2021","53139","","UI tests - A user can create a pool MGA - newToken","","UI tests - A user can create a pool MGA - newToken","As a User I can create a pool","As a User I can create a pool",""
"failed","Sat Nov 13 01:33:00 GMT 2021","Sat Nov 13 01:35:36 GMT 2021","155627","","UI tests - A user can swap and mint tokens","","UI tests - A user can swap and mint tokens","As a User I can burn all liquidity MGA - mETH","As a User I can burn all liquidity MGA - mETH",""
"failed","Sat Nov 13 01:43:40 GMT 2021","Sat Nov 13 01:43:41 GMT 2021","560","","UI tests - A user can use MAX:","","UI tests - A user can use MAX:","As a User I can mint All tokens newToken - newToken2","As a User I can mint All tokens newToken - newToken2",""
"passed","Sat Nov 13 01:47:12 GMT 2021","Sat Nov 13 01:49:23 GMT 2021","130746","","Accuracy tests:","","Accuracy tests:","As a User I get the right values for Pool removal P[2500000000000000000, 5000000000000000000] - I-> 1 -Expected - 0.025 , 0.05","As a User I get the right values for Pool removal P[2500000000000000000, 5000000000000000000] - I-> 1 -Expected - 0.025 , 0.05",""
"failed","Sat Nov 13 02:02:12 GMT 2021","Sat Nov 13 02:02:32 GMT 2021","19863","","UI tests: Infra","","UI tests: Infra","Validate that Frontend retrieves AssetInfo data","Validate that Frontend retrieves AssetInfo data",""
"failed","Sat Nov 13 01:43:42 GMT 2021","Sat Nov 13 01:43:43 GMT 2021","487","","UI tests - A user can see the new Modal","","UI tests - A user can see the new Modal","Modal is visible when burning liquidity","Modal is visible when burning liquidity",""
"passed","Sat Nov 13 01:35:36 GMT 2021","Sat Nov 13 01:38:40 GMT 2021","183977","","UI tests - A user can swap and mint tokens","","UI tests - A user can swap and mint tokens","As a User I can mint in more than one pool [ MGA - mETH ] [ MGA - newTokn ] and get invested values","As a User I can mint in more than one pool [ MGA - mETH ] [ MGA - newTokn ] and get invested values",""
"passed","Sat Nov 13 02:02:00 GMT 2021","Sat Nov 13 02:02:12 GMT 2021","12200","","UI tests: Infra","","UI tests: Infra","Validate that Mangata Frontend up and running","Validate that Mangata Frontend up and running",""
"passed","Sat Nov 13 01:52:34 GMT 2021","Sat Nov 13 01:54:29 GMT 2021","114547","","Accuracy tests","","Accuracy tests","As a User I get the right values for Pool investment P[5000000000000000000, 5000000000000000000] - I-> 0.123 -Expected - 0.123","As a User I get the right values for Pool investment P[5000000000000000000, 5000000000000000000] - I-> 0.123 -Expected - 0.123",""
"passed","Sat Nov 13 01:59:17 GMT 2021","Sat Nov 13 02:01:56 GMT 2021","158504","","UI tests - Get Tokens from Faucet","","UI tests - Get Tokens from Faucet","As a User I can get test tokens from the faucet","As a User I can get test tokens from the faucet",""
"failed","Sat Nov 13 02:01:58 GMT 2021","Sat Nov 13 02:01:58 GMT 2021","529","","UI tests - Extension management","","UI tests - Extension management","As a User I get feedback when extensions are installed and correctly setup","As a User I get feedback when extensions are installed and correctly setup",""
"failed","Sat Nov 13 02:01:57 GMT 2021","Sat Nov 13 02:01:58 GMT 2021","684","","UI tests - Extension management","","UI tests - Extension management","As a User I get infomed whenever is neccesary to install any extension","As a User I get infomed whenever is neccesary to install any extension",""
"passed","Sat Nov 13 01:45:13 GMT 2021","Sat Nov 13 01:47:12 GMT 2021","119176","","Accuracy tests:","","Accuracy tests:","As a User I get the right values for Pool removal P[2499999999999999999, 5000000000000000000] - I-> 2 -Expected - 0.049 , 0.100","As a User I get the right values for Pool removal P[2499999999999999999, 5000000000000000000] - I-> 2 -Expected - 0.049 , 0.100",""
"failed","Sat Nov 13 01:43:41 GMT 2021","Sat Nov 13 01:43:42 GMT 2021","515","","UI tests - A user can see the new Modal","","UI tests - A user can see the new Modal","Modal contains currencies and amounts when Swapping","Modal contains currencies and amounts when Swapping",""
"failed","Sat Nov 13 01:29:09 GMT 2021","Sat Nov 13 01:30:32 GMT 2021","83432","","UI tests - A user can swap and mint tokens","","UI tests - A user can swap and mint tokens","As a User I can Swap tokens - MGA - mETH","As a User I can Swap tokens - MGA - mETH",""
"failed","Sat Nov 13 01:43:39 GMT 2021","Sat Nov 13 01:43:40 GMT 2021","541","","UI tests - A user can use MAX:","","UI tests - A user can use MAX:","As a User I can Swap All MGA tokens -> newToken","As a User I can Swap All MGA tokens -> newToken",""
"failed","Sat Nov 13 01:43:42 GMT 2021","Sat Nov 13 01:43:42 GMT 2021","561","","UI tests - A user can see the new Modal","","UI tests - A user can see the new Modal","Modal contains currencies and amounts when providing liquidity","Modal contains currencies and amounts when providing liquidity",""
