"Status","Start Time","Stop Time","Duration in ms","Parent Suite","Suite","Sub Suite","Test Class","Test Method","Name","Description"
"failed","Sat Jun 04 03:55:29 GMT 2022","Sat Jun 04 03:59:11 GMT 2022","222482","","UI tests - Get Tokens from Faucet","","UI tests - Get Tokens from Faucet","As a User I can get test tokens from the faucet","As a User I can get test tokens from the faucet",""
"failed","Sat Jun 04 01:46:26 GMT 2022","Sat Jun 04 01:51:26 GMT 2022","300003","","UI tests - A user can see the new Modal","","UI tests - A user can see the new Modal","Modal is visible when burning liquidity","Modal is visible when burning liquidity",""
"failed","Sat Jun 04 02:52:28 GMT 2022","Sat Jun 04 02:59:06 GMT 2022","397588","","UI tests - Extension management","","UI tests - Extension management","As a User I can not see hidden wallets in the modal","As a User I can not see hidden wallets in the modal",""
"failed","Sat Jun 04 03:41:19 GMT 2022","Sat Jun 04 03:41:19 GMT 2022","7","","Accuracy tests","","Accuracy tests","As a User I get the right values for Pool investment P[5000000000000000000, 100] - I-> 100000000000 -Expected - 0.000002","As a User I get the right values for Pool investment P[5000000000000000000, 100] - I-> 100000000000 -Expected - 0.000002",""
"skipped","Sat Jun 04 03:04:07 GMT 2022","Sat Jun 04 03:04:07 GMT 2022","0","","UI tests > Balances","","UI tests > Balances","As a User I can see the min/max when withdrawing","As a User I can see the min/max when withdrawing",""
"failed","Sat Jun 04 03:31:18 GMT 2022","Sat Jun 04 03:36:18 GMT 2022","300022","","UI tests - A user swapping tokens:","","UI tests - A user swapping tokens:","Token amounts are correectly propagated to the node","Token amounts are correectly propagated to the node",""
"failed","Sat Jun 04 02:39:12 GMT 2022","Sat Jun 04 02:45:51 GMT 2022","398712","","UI tests - Extension management","","UI tests - Extension management","As a User I can switch between polkadot wallets","As a User I can switch between polkadot wallets",""
"failed","Sat Jun 04 03:41:19 GMT 2022","Sat Jun 04 03:41:19 GMT 2022","1","","Accuracy tests","","Accuracy tests","As a User I get the right values for Pool investment P[2500000000000000000, 5000000000000000000] - I-> 0.100 -Expected - 0.200","As a User I get the right values for Pool investment P[2500000000000000000, 5000000000000000000] - I-> 0.100 -Expected - 0.200",""
"failed","Sat Jun 04 03:04:07 GMT 2022","Sat Jun 04 03:04:07 GMT 2022","3","","UI tests > Balances","","UI tests > Balances","As a User I can see the max possible value in UI","As a User I can see the max possible value in UI",""
"failed","Sat Jun 04 01:51:26 GMT 2022","Sat Jun 04 01:56:26 GMT 2022","300005","","UI tests - A user gets notified when error","","UI tests - A user gets notified when error","When tx front - fails, User gets notified","When tx front - fails, User gets notified",""
"failed","Sat Jun 04 01:56:26 GMT 2022","Sat Jun 04 02:01:26 GMT 2022","300003","","UI tests - A user gets notified when error","","UI tests - A user gets notified when error","When tx extrinsic - fails, User gets notified","When tx extrinsic - fails, User gets notified",""
"failed","Sat Jun 04 02:01:26 GMT 2022","Sat Jun 04 02:06:26 GMT 2022","300002","","UI tests - A user gets notified when error","","UI tests - A user gets notified when error","When user cancel a TX, User gets notified","When user cancel a TX, User gets notified",""
"passed","Sat Jun 04 03:59:12 GMT 2022","Sat Jun 04 03:59:15 GMT 2022","2886","","UI tests: Infra","","UI tests: Infra","Validate that Mangata Frontend up and running","Validate that Mangata Frontend up and running",""
"failed","Sat Jun 04 02:26:28 GMT 2022","Sat Jun 04 02:32:35 GMT 2022","366793","","UI tests - Extension management","","UI tests - Extension management","As a User I get infomed whenever is neccesary to install any extension","As a User I get infomed whenever is neccesary to install any extension",""
"failed","Sat Jun 04 03:14:11 GMT 2022","Sat Jun 04 03:16:15 GMT 2022","124116","","UI main tests - Deposit - ETH","","UI main tests - Deposit - ETH","As a User I can deposit ETH from Meta extension","As a User I can deposit ETH from Meta extension",""
"failed","Sat Jun 04 02:11:27 GMT 2022","Sat Jun 04 02:16:27 GMT 2022","300005","","UI tests - A user can swap and mint tokens","","UI tests - A user can swap and mint tokens","As a User I can mint some tokens MGA - mETH","As a User I can mint some tokens MGA - mETH",""
"failed","Sat Jun 04 03:59:15 GMT 2022","Sat Jun 04 03:59:29 GMT 2022","13836","","UI tests: Infra","","UI tests: Infra","Validate that Frontend retrieves AssetInfo data","Validate that Frontend retrieves AssetInfo data",""
"failed","Sat Jun 04 02:16:27 GMT 2022","Sat Jun 04 02:21:27 GMT 2022","300003","","UI tests - A user can swap and mint tokens","","UI tests - A user can swap and mint tokens","As a User I can burn all liquidity MGA - mETH","As a User I can burn all liquidity MGA - mETH",""
"failed","Sat Jun 04 03:47:57 GMT 2022","Sat Jun 04 03:47:57 GMT 2022","207","","UI tests - A user can create a pool MGA - newToken","","UI tests - A user can create a pool MGA - newToken","As a User I can create a pool","As a User I can create a pool",""
"failed","Sat Jun 04 03:31:17 GMT 2022","Sat Jun 04 03:31:17 GMT 2022","6","","Accuracy tests:","","Accuracy tests:","As a User I get the right values for Pool removal P[2499999999999999999, 5000000000000000000] - I-> 2 -Expected - 0.049 , 0.100","As a User I get the right values for Pool removal P[2499999999999999999, 5000000000000000000] - I-> 2 -Expected - 0.049 , 0.100",""
"failed","Sat Jun 04 02:06:27 GMT 2022","Sat Jun 04 02:11:27 GMT 2022","300023","","UI tests - A user can swap and mint tokens","","UI tests - A user can swap and mint tokens","As a User I can Swap tokens - MGA - mETH","As a User I can Swap tokens - MGA - mETH",""
"failed","Sat Jun 04 03:31:17 GMT 2022","Sat Jun 04 03:31:17 GMT 2022","3","","Accuracy tests:","","Accuracy tests:","As a User I get the right values for Pool removal P[2500000000000000000, 5000000000000000000] - I-> 1 -Expected - 0.025 , 0.05","As a User I get the right values for Pool removal P[2500000000000000000, 5000000000000000000] - I-> 1 -Expected - 0.025 , 0.05",""
"failed","Sat Jun 04 03:04:07 GMT 2022","Sat Jun 04 03:04:07 GMT 2022","1","","UI tests > Balances","","UI tests > Balances","As a User I can see the min value in UI","As a User I can see the min value in UI",""
"failed","Sat Jun 04 03:26:15 GMT 2022","Sat Jun 04 03:26:15 GMT 2022","10","","UI main tests - Withdraw - ETH","","UI main tests - Withdraw - ETH","As a User I can Withdraw ETH from Meta extension","As a User I can Withdraw ETH from Meta extension",""
"failed","Sat Jun 04 02:45:51 GMT 2022","Sat Jun 04 02:52:28 GMT 2022","397022","","UI tests - Extension management","","UI tests - Extension management","As a User I can switch between polkadot wallets using the modal","As a User I can switch between polkadot wallets using the modal",""
"failed","Sat Jun 04 03:41:19 GMT 2022","Sat Jun 04 03:41:19 GMT 2022","1","","Accuracy tests","","Accuracy tests","As a User I get the right values for Pool investment P[5000000000000000000, 5000000000000000000] - I-> 0.123 -Expected - 0.123","As a User I get the right values for Pool investment P[5000000000000000000, 5000000000000000000] - I-> 0.123 -Expected - 0.123",""
"failed","Sat Jun 04 01:41:26 GMT 2022","Sat Jun 04 01:46:26 GMT 2022","300002","","UI tests - A user can see the new Modal","","UI tests - A user can see the new Modal","Modal contains currencies and amounts when providing liquidity","Modal contains currencies and amounts when providing liquidity",""
"failed","Sat Jun 04 03:26:16 GMT 2022","Sat Jun 04 03:26:16 GMT 2022","5","","UI tests - A user can use MAX:","","UI tests - A user can use MAX:","As a User I can mint All tokens newToken - newToken2","As a User I can mint All tokens newToken - newToken2",""
"failed","Sat Jun 04 03:26:16 GMT 2022","Sat Jun 04 03:26:16 GMT 2022","34","","UI tests - A user can use MAX:","","UI tests - A user can use MAX:","As a User I can Swap All MGA tokens -> newToken","As a User I can Swap All MGA tokens -> newToken",""
"failed","Sat Jun 04 01:36:26 GMT 2022","Sat Jun 04 01:41:26 GMT 2022","300028","","UI tests - A user can see the new Modal","","UI tests - A user can see the new Modal","Modal contains currencies and amounts when Swapping","Modal contains currencies and amounts when Swapping",""
"failed","Sat Jun 04 02:21:27 GMT 2022","Sat Jun 04 02:26:27 GMT 2022","300003","","UI tests - A user can swap and mint tokens","","UI tests - A user can swap and mint tokens","As a User I can mint in more than one pool [ MGA - mETH ] [ MGA - newTokn ] and get invested values","As a User I can mint in more than one pool [ MGA - mETH ] [ MGA - newTokn ] and get invested values",""
"failed","Sat Jun 04 02:32:35 GMT 2022","Sat Jun 04 02:39:12 GMT 2022","397436","","UI tests - Extension management","","UI tests - Extension management","As a User I get feedback when extensions are installed and correctly setup","As a User I get feedback when extensions are installed and correctly setup",""
